{
  "specVersion": "0.1",
  "id": "java/modern-17",
  "area": "java",
  "description": "现代版本读 javaVersion.majorVersion=17",
  "given": {
    "operation": "requiredJava",
    "snapshot": "snapshots/versions/1.20.4.json"
  },
  "expect": {
    "majorVersion": 17,
    "distribution": "temurin",
    "runtimeKind": "jre"
  }
}
