{
  "specVersion": "0.1",
  "id": "client-download/paper-unsupported",
  "area": "client-download",
  "description": "paper 无客户端下载计划 → 显式 E_UNSUPPORTED_TYPE",
  "given": {
    "operation": "planClientDownload",
    "version": "1.20.4",
    "type": "paper",
    "platform": { "os": "linux", "arch": "x86_64" },
    "root": "/tmp/orzmc-fixture",
    "snapshot": "snapshots/versions/1.20.4.json"
  },
  "expectError": { "code": "E_UNSUPPORTED_TYPE" }
}
