{
  "specVersion": "0.1",
  "id": "server-plan/paper-unsupported",
  "area": "server-plan",
  "description": "paper 无离线部署计划（核心走 API 解析）→ 显式 E_UNSUPPORTED_OP",
  "given": {
    "operation": "planServerDeploy",
    "root": "/tmp/orzmc",
    "version": "1.20.4",
    "type": "paper",
    "snapshot": "snapshots/versions/1.20.4.json"
  },
  "expectError": { "code": "E_UNSUPPORTED_OP" }
}
